ID-datalake,nct_id,brief_title,official_title,phase,recruitment_status,start_date,completion_date,primary_completion_date,enrollment,enrollment_type,lead_sponsor,sponsor_organization,indications,interventions_drugs,drugs_datalake,main_technologies,specific_technologies,target_names,target_abbreviations
17607,NCT01183494,A Genotype-guided Study of Irinotecan Administered in Combination With 5-fluorouracil/Leucovorin (FOLFIRI) and Bevacizumab in Advanced Colorectal Cancer Patients,A Genotype-guided Phase I Study of Irinotecan Administered in Combination With 5-fluorouracil/Leucovorin (FOLFIRI) and Bevacizumab in Advanced Colorectal Cancer Patients,PHASE1,COMPLETED,12/12/2009,2/6/2017,2/6/2017,17,ACTUAL,,,['Colorectal Cancer'],"['Bevacizumab', 'Irinotecan', 'Fluorouracil/folinic-acid']","['B167', 'B1679', 'B4749']","[['Antibody'], ['Small Molecule'], ['Small Molecule']]","[['Monoclonal Antibody'], ['Small Molecule'], ['Small Molecule']]","[['Vascular endothelial growth factor A'], ['DNA topoisomerase I'], ['Thymidylate synthase']]","[['VEGF-A'], ['TOP1'], ['TYMS']]"
16056,NCT01013740,Lapatinib in Combination With Vinorelbine,"A Phase II, Randomised, Multi-Centre Study Evaluating Lapatinib in Combination With Vinorelbine or Capecitabine in Women With ErbB2 Overexpressing Metastatic Breast Cancer",PHASE2,COMPLETED,25/11/2009,1/3/2016,21/8/2012,112,ACTUAL,,,['Cancer'],"['Vinorelbine', 'Lapatinib', 'Capecitabine']","['B1929', 'B1930', 'B474']","[['Small Molecule'], ['Small Molecule'], ['Small Molecule']]","[['Small Molecule'], ['Small Molecule'], ['Small Molecule']]","[['Tubulin beta-1 chain'], ['Epidermal growth factor receptor erbB1', 'Receptor protein-tyrosine kinase erbB-2'], ['Thymidylate synthase']]","[['TUBB1'], ['EGFR', 'HER2'], ['TYMS']]"
16125,NCT01019382,A Study of the Effect of Gemcitabine With Fish Oil in Patients With Advanced Pancreatic Cancer,Phase II Trial of the Effect of Gemcitabine With Intravenous Omega-3 Fish Oil Infusion in Patients With Unresectable Pancreatic Adenocarcinoma,PHASE2,COMPLETED,31/10/2009,30/6/2014,30/6/2014,50,ACTUAL,,,['Pancreatic Cancer'],"['Gemcitabine', 'Fish oil']","['B2079', 'B1120']","[['Small Molecule'], []]","[['Small Molecule'], []]","[['DNA', 'Ribonucleotide reductase'], []]","[['DNA', 'RNR'], []]"
13722,NCT00788697,SonoVueÂ®-Enhanced Ultrasound Versus Unenhanced US for Focal Liver Lesion Characterization,"Characterization of Focal Liver Lesions With SONOVUEÂ®-Enhanced Ultrasound Imaging: A Phase III, Intrapatient Comparative Study Versus Un-enhanced Ultrasound Imaging Using Histology or Combined Imaging/Clinical Data as Truth Standard",PHASE3,COMPLETED,30/9/2009,31/7/2013,31/7/2013,349,ACTUAL,,,['Liver Cancer'],"['Sulfur hexafluoride', 'Contrast-Enhanced Ultrasound', 'Unenhanced ultrasound']",['B483'],[['Small Molecule']],[['Small Molecule']],[[]],[[]]
15731,NCT00982436,Neoadjuvant Cisplatin/Docetaxel (CDDP/TXT) and Chemoradiation for Head and Neck Cancer,A Pilot Study to Evaluate Response to Neoadjuvant Chemotherapy With Cisplatin and Docetaxel Followed by Chemoradiation Therapy With Carboplatin in Stage IV Non-metastatic Head and Neck Cancer,PHASE1/PHASE2,UNKNOWN,30/9/2009,31/12/2012,30/9/2012,37,ESTIMATED,,,['Head and Neck Neoplasm'],"['Docetaxel', 'Cisplatin', 'Radiation Therapy', 'Carboplatin']","['B2814', 'B49', 'B274']","[['Small Molecule'], ['Small Molecule'], ['Small Molecule']]","[['Small Molecule'], ['Small Molecule'], ['Small Molecule']]","[['Tubulin beta-1 chain'], ['DNA'], ['DNA']]","[['TUBB1'], ['DNA'], ['DNA']]"
17397,NCT01160484,"Pegylated Liposomal Doxorubicin, Bortezomib, Dexamethasone and Lenalidomide for Relapsed/Refractory Multiple Myeloma","A Phase II Study of Pegylated Liposomal Doxorubicin, Bortezomib, Dexamethasone and Lenalidomide (DVD-R) for Patients With Relapsed/Refractory Multiple Myeloma",PHASE2,COMPLETED,30/9/2009,30/9/2012,31/12/2011,40,ACTUAL,,,['Multiple Myeloma'],"['Dexamethasone', 'Bortezomib', 'Pegylated Liposomal Doxorubicin Hydrochloride', 'Lenalidomide']","['B1128', 'B958', 'B2071']","[['Small Molecule'], ['Small Molecule'], ['Small Molecule']]","[['Small Molecule'], ['Small Molecule'], ['Molecular glue']]","[['Glucocorticoid receptor'], ['Proteasome'], ['casein kinase 1 alpha 1', 'Cereblon', 'DNA-binding protein Ikaros', 'Interleukin-2', 'Interleukin-6', 'Tumor necrosis factor Î±', 'Zinc finger protein Aiolos']]","[['GR'], ['Proteasome'], ['IFNÎ³', 'CK1Î±', 'CRBN', 'IKZF1', 'IL-2', 'IL-6', 'TNF-Î±', 'IKZF3']]"
15416,NCT00952289,COntrolled MyeloFibrosis Study With ORal JAK Inhibitor Treatment: The COMFORT-I Trial,"A Randomized, Double-blind, Placebo-controlled Study of the JAK Inhibitor INCB018424 Tablets Administered Orally to Subjects With Primary Myelofibrosis, Post-Polycythemia Vera Myelofibrosis or Post-Essential Thrombocythemia Myelofibrosis",PHASE3,COMPLETED,31/8/2009,31/10/2015,30/11/2010,309,ACTUAL,,,['Myeloproliferative Neoplasm'],"['Ruxolitinib', 'Placebo Control']",['B481'],[['Small Molecule']],[['Small Molecule']],"[['Tyrosine-protein kinase JAK1', 'Tyrosine-protein kinase JAK2']]","[['JAK1', 'JAK2']]"
58044,NCT00838513,Open Label Controlled Trial of Eculizumab in Adult Patients With Plasma Therapy-sensitive Atypical Hemolytic Uremic Syndrome (aHUS),"An Open-label, Multi-center Controlled Clinical Trial of Eculizumab in Adult Patients With Plasma Therapy-sensitive Atypical Hemolytic Uremic Syndrome (AHUS)",PHASE2,COMPLETED,31/7/2009,31/12/2013,31/10/2010,15,ACTUAL,,,['Atypical Hemolytic Uremic Syndrome'],['Eculizumab'],['B195'],[['Antibody']],[['Monoclonal Antibody']],[[]],[['C5']]
15158,NCT00927589,A Study to Evaluate Corrected QT Interval and Drug-Drug Interaction of Trastuzumab on Carboplatin in the Presence of Docetaxel in Patients With HER2-Positive Metastatic or Locally Advanced Inoperable Cancer,"A Phase 1b, Single-arm, Open-label Clinical Trial to Evaluate Corrected QT Interval and Drug-drug Interaction of Trastuzumab on Carboplatin in the Presence of Docetaxel in Patients With Metastatic Cancer",PHASE1,COMPLETED,31/7/2009,28/2/2013,28/2/2013,59,ACTUAL,,,['Epithelial Neoplasm'],"['Carboplatin', 'Docetaxel', 'Trastuzumab']","['B274', 'B2814', 'B168']","[['Small Molecule'], ['Small Molecule'], ['Antibody']]","[['Small Molecule'], ['Small Molecule'], ['Monoclonal Antibody']]","[['DNA'], ['Tubulin beta-1 chain'], ['Receptor protein-tyrosine kinase erbB-2']]","[['DNA'], ['TUBB1'], ['HER2']]"
15217,NCT00933374,Trial to Evaluate Paclitaxel Plus RAD001 in Urothelial Carcinoma,"A Single Arm, Multi-center Phase II Trial to Evaluate Paclitaxel Plus RAD001 in Urothelial Carcinoma After Failure of Prior Platin-based Chemotherapy",PHASE2,TERMINATED,31/7/2009,30/9/2013,31/1/2013,28,ACTUAL,,,['Bladder Cancer'],"['Paclitaxel', 'Everolimus']","['B1250', 'B511']","[['Small Molecule'], ['Small Molecule']]","[['Small Molecule'], ['Small Molecule']]","[['Tubulin beta-1 chain'], ['Mammalian target of Rapamycin', 'mTOR Complex 2']]","[['TUBB1'], ['mTORC1', 'mTORC2']]"
15517,NCT00961896,"A Trial to Evaluate the Safety, Local Tolerability, Pharmacokinetics and Pharmacodynamics of LDE225 on Skin Basal Cell Carcinomas in Gorlin Syndrome Patients","A Double-blind, Randomized, Vehicle-controlled Proof of Concept (PoC) Study to Evaluate the Safety, Local Tolerability, Pharmacokinetics and Pharmacodynamics of Multiple Topical Administrations of LDE225 (a Specific Smoothened Inhibitor) on Skin Basal Cell Carcinomas in Gorlin Syndrome Patients Followed by an Open Label, Randomized Expansion Group to Test Two Different Strengths of an Improved LDE225 Formulation for Extended Treatment Durations",PHASE2,COMPLETED,31/7/2009,,31/8/2010,18,ACTUAL,,,['Skin Basal Cell Carcinoma'],"['Drug Vehicle', 'Sonidegib']",['B593'],[['Small Molecule']],[['Small Molecule']],[['Smoothened receptor']],[['SMO']]
15520,NCT00962507,Panobinostat and Everolimus in Treating Patients With Relapsed or Refractory Lymphoma or Multiple Myeloma,"A Phase I Study Evaluating the Combination of the Deacetylase Inhibitor, LBH589 Plus the mTOR Inhibitor RAD001, in Relapsed and Refractory Adult Patients With Lymphoma",PHASE1,COMPLETED,31/7/2009,31/1/2013,31/1/2013,11,ACTUAL,,,"['Hematology', 'Plasma Cell Neoplasm']","['Everolimus', 'Panobinostat', 'Laboratory Biomarker Analysis']","['B511', 'B1683']","[['Small Molecule'], ['Small Molecule']]","[['Small Molecule'], ['Small Molecule']]","[['Mammalian target of Rapamycin', 'mTOR Complex 2'], ['Hypoxia-inducible factor 1 alpha', 'Vascular endothelial growth factor']]","[['mTORC1', 'mTORC2'], ['HDACs', 'HIF-1Î±', 'VEGF']]"
48928,NCT05278728,Phase IIa Study of Nimotuzumab to Treat Colorectal Cancer,Phase IIa Study of Nimotuzumab Plus Irinotecan as Second-line Treatment in Metastatic Colorectal Cancer With Wild Type K-ras,PHASE1/PHASE2,COMPLETED,31/7/2009,31/12/2013,31/8/2013,31,ACTUAL,,,['Colorectal Cancer'],"['Nimotuzumab', 'Irinotecan']","['B662', 'B1679']","[['Antibody'], ['Small Molecule']]","[['Monoclonal Antibody'], ['Small Molecule']]","[['Epidermal growth factor receptor erbB1'], ['DNA topoisomerase I']]","[['EGFR'], ['TOP1']]"
15059,NCT00918723,"Vorinostat, Fludarabine Phosphate, Cyclophosphamide, and Rituximab in Treating Patients With Previously Untreated Chronic Lymphocytic Leukemia or Small Lymphocytic Lymphoma","A Phase I/II Study of Fludarabine, Cyclophosphamide, Rituximab, and Vorinostat Followed by Rituximab and Vorinostat Maintenance Therapy in Patients With Previously Untreated B-Cell Chronic Lymphocytic Leukemia (CLL) or Small Lymphocytic Lymphoma (SLL)",PHASE1/PHASE2,COMPLETED,30/6/2009,31/10/2016,31/10/2016,40,ACTUAL,,,"['Small Lymphocytic Lymphoma', 'Chronic Lymphocytic Leukemia', 'Small Lymphocytic Lymphoma', 'Chronic Lymphocytic Leukemia', 'Small Lymphocytic Lymphoma', 'Chronic Lymphocytic Leukemia', 'Small Lymphocytic Lymphoma', 'Chronic Lymphocytic Leukemia', 'Chronic Lymphocytic Leukemia']","['fludarabine phosphate', 'Cyclophosphamide', 'Rituximab', 'Vorinostat']","['B8555', 'B2818', 'B163', 'B2107']","[[], ['Small Molecule'], ['Antibody'], ['Small Molecule']]","[[], ['Small Molecule'], ['Monoclonal Antibody'], ['Small Molecule']]","[[], ['DNA'], ['B-lymphocyte antigen CD20'], ['Histone deacetylase']]","[[], ['DNA'], ['CD20'], ['HDAC']]"
15296,NCT00940784,Clopidogrel and Aspirin for the Treatment of Polycythemia Vera,"MPD-RC 108: Phase II, Randomized, Double-Blind, Placebo Controlled International Study of Clopidogrel and Aspirin for the Treatment of Polycythemia Vera",PHASE2,WITHDRAWN,30/6/2009,31/1/2011,31/1/2011,0,ACTUAL,,,['Polycythemia Vera'],"['Clopidogrel', 'Aspirin', 'Hydroxycarbamide', 'Placebo Control']","['B473', 'B856', 'B3055']","[['Small Molecule'], ['Small Molecule'], ['Small Molecule']]","[['Small Molecule'], ['Small Molecule'], ['Small Molecule']]","[[], ['Cyclooxygenases'], ['Ribonucleotide reductase']]","[['P2Y12 receptor'], ['COX'], ['RNR']]"
20793,NCT01528501,Histone Deacetylases - Gastric Cancer (HDAC-GaCa-2008),"An Open-label, Uncontrolled Phase II Trial of HDAC-Inhibitor LBH589 in Patients With Chemo-refractory Metastatic Gastric Cancer Overexpressing Histone Deacetylases (HDACs) - CLBH589BDE03T",PHASE2,TERMINATED,30/6/2009,,28/2/2013,28,ESTIMATED,,,['Gastric Cancer'],['Panobinostat'],['B1683'],[['Small Molecule']],[['Small Molecule']],"[['Hypoxia-inducible factor 1 alpha', 'Vascular endothelial growth factor']]","[['HDACs', 'HIF-1Î±', 'VEGF']]"
13911,NCT00807170,Investigate the Maximum Tolerated Dose of Vandetanib and Concurrent Whole Brain Radiotherapy (WBRT) in Patients With Non-small Cell Lung Cancer (NSCLC) and Brain Metastases,A Phase I Study of ZD6474 (Vandetanib) Concurrent With Whole Brain Radiotherapy for the Treatment of Brain Metastases in Patients With Non-small Cell Lung Cancer (NSCLC),PHASE1,TERMINATED,31/5/2009,31/8/2010,31/8/2010,5,ACTUAL,,,['Non-Small Cell Lung Cancer'],"['Vandetanib', 'Whole-Brain Radiotherapy']",['B854'],[['Small Molecule']],[['Small Molecule']],"[['Epidermal growth factor receptor erbB1', 'Tyrosine-protein kinase receptor RET', 'Vascular endothelial growth factor receptor 2']]","[['EGFR', 'RET', 'VEGFR2']]"
14992,NCT00911326,Evaluation of Sentinel Lymph Nodes in Head and Neck Squamous Cell Carcinoma,"A Ph 3, Prospective, Open-Label, Multicenter Study of LymphoseekÂ®-Identified Sentinel Lymph Nodes (SLNs) Relative to the Path Status of Non SLN in an Elective Neck Dissection in Cutaneous Head and Neck and Intraoral Squamous Cell Carcinoma",PHASE3,TERMINATED,31/5/2009,31/8/2013,31/8/2013,101,ACTUAL,,,['Head and Neck Squamous Cell Carcinoma'],['Tc 99m tilmanocept'],['B2197'],[['Imaging']],[['Imaging Agent']],[['Macrophage mannose receptor 1']],[['CD206']]
20068,NCT01449344,Efficacy and Safety of R-HAD Alone or in Combination With Bortezomib in Patients With Relapsed or Refractory MCL,"Efficacy and Safety of Rituximab, High-dose Ara-C and Dexamethasone (R-HAD) Alone or in Combination With Bortezomib in Patients With Relapsed or Refractory Mantle Cell Lymphoma",PHASE3,UNKNOWN,9/5/2009,31/12/2018,31/12/2018,128,ACTUAL,,,['Mantle Cell Lymphoma'],"['Rituximab', 'Cytarabine', 'Dexamethasone', 'Bortezomib']","['B163', 'B2050', 'B1128', 'B958']","[['Antibody'], ['Small Molecule'], ['Small Molecule'], ['Small Molecule']]","[['Monoclonal Antibody'], ['Small Molecule'], ['Small Molecule'], ['Small Molecule']]","[['B-lymphocyte antigen CD20'], ['DNA-directed DNA polymerase'], ['Glucocorticoid receptor'], ['Proteasome']]","[['CD20'], ['DNA-directed DNA polymerase'], ['GR'], ['Proteasome']]"
14181,NCT00833040,"A Study for the Evaluation of the Safety, Tolerability, and Efficacy of ARX-F02 (Sufentanil NanoTab) Compared to Placebo in the Treatment of Cancer Breakthrough Pain","A Multicenter, Randomized, Placebo-Controlled, Crossover Study for the Evaluation of the Safety, Tolerability, and Efficacy of ARX-F02 Compared to Placebo in the Treatment of Cancer Breakthrough Pain",PHASE2,COMPLETED,30/4/2009,31/3/2010,31/3/2010,34,ACTUAL,,,"['Cancer', 'Connective and Soft Tissue Neoplasm']","['Sufentanil', 'Placebo Control']",['B1995'],[['Small Molecule']],[['Small Molecule']],[['Opioid receptors']],[['Opioid receptors']]
14538,NCT00868478,The Humanized Monoclonal Antibody Milatuzumab for Refractory Chronic Lymphocytic Leukemia (CLL),Phase I-II Trial of the Anti CD74 Monoclonal Antibody-Milatuzumab as a Single Agent in Refractory Chronic Lymphocytic Leukemia,PHASE1/PHASE2,UNKNOWN,30/4/2009,30/4/2012,30/4/2011,15,ESTIMATED,,,['Chronic Lymphocytic Leukemia'],['Milatuzumab'],['B437'],[['Antibody']],[['Monoclonal Antibody']],[['HLA-DR antigens-associated invariant chain']],[['CD74']]
22450,NCT01729663,"Phase II/III Clinical Study CSF470 Plus BCG Plus GM-CSF vs IFN Alpha 2b in Stage IIB, IIC and III Melanoma Patients","Randomized, Comparative Phase II/III Study Between Treatment With CSF470 Vaccine (Allogeneic, Irradiated) Plus BCG and MOLGRAMOSTIN (rhGM-CSF) as Adjuvants and Interferon-alfa 2b (IFN-ALPHA), in Stages IIB, IIC and III Post Surgery Cutaneous Melanoma Patients",PHASE2/PHASE3,UNKNOWN,30/4/2009,,31/12/2018,108,ESTIMATED,,,['Skin Melanoma'],"['Allogeneic Irradiated Melanoma Cell Vaccine CSF470', 'BCG vaccine', 'Molgramostim', 'Interferon-alpha-2']","['B722', 'B734', 'B5612']","[['Live biotherapeutics'], ['Other Protein Therapy'], []]","[['Live biotherapeutics'], ['Colony-Stimulating Factor'], []]","[[], ['Granulocyte-macrophage colony-stimulating factor receptor'], ['Interferon alpha/beta receptor']]","[[], ['CSF-2R'], ['IFNAR']]"
14415,NCT00858429,Yttrium Y 90 Glass Microspheres and Capecitabine in Treating Patients With Liver Cholangiocarcinoma or Liver Metastases,Dose Escalating Study of Yttrium 90 Microspheres (TheraSphere) With Capecitabine (Xeloda) for Intrahepatic Cholangiocarcinoma or Metastatic Disease to the Liver,PHASE1,COMPLETED,1/4/2009,8/7/2014,19/3/2014,18,ACTUAL,,,"['Liver Cancer', 'Anal Cancer']","['Capecitabine', 'Yttrium Y 90 Glass Microspheres']",['B474'],[['Small Molecule']],[['Small Molecule']],[['Thymidylate synthase']],[['TYMS']]
13101,NCT00723398,Nutritional Supplements and Hormonal Manipulations for Breast Cancer Prevention,Combination of Low Dose Antiestrogens With Omega-3 Fatty Acids for Prevention of Hormone-independent Breast Cancer,,COMPLETED,31/3/2009,30/4/2015,30/4/2015,266,ACTUAL,,,['Breast Cancer'],"['Omega-3-acid ethyl esters', 'Raloxifene']","['B101', 'B2055']","[['Small Molecule'], ['Small Molecule']]","[['Small Molecule'], ['Small Molecule']]","[[], ['Estrogen receptor beta', 'Estrogen receptors']]","[['Lipid', 'Triglyceride'], ['ERÎ²', 'ER']]"
14499,NCT00866177,MEK Inhibitor AZD6244 in Treating Patients With Stage III or Stage IV Melanoma,Phase II Trial of Hyd-sulfate AZD6244 [NSC 748727] in Patients With BRAF or NRAS Mutated Melanomas,PHASE2,COMPLETED,31/3/2009,30/9/2013,30/9/2013,167,ACTUAL,,,"['Skin Melanoma', 'Skin Melanoma', 'Skin Melanoma']","['Laboratory Biomarker Analysis', 'Selumetinib']",['B360'],[['Small Molecule']],[['Small Molecule']],"[['Dual specificity mitogen-activated protein kinase kinase 1', 'Dual specificity mitogen-activated protein kinase kinase 2']]","[['MEK1', 'MEK2']]"
14519,NCT00867061,"Efficacy and Safety of 5-day Dosing of ON 01910.Na in Intermediate-1,-2, or High Risk Myelodysplastic Syndrome (MDS)","A Phase 1/2, Single-Arm Study To Assess The Efficacy and Safety Of 5-day Continuous Intravenous Dosing Of ON 01910.Na Administered Every 2 Weeks in Patients With Intermediate-1, Intermediate-2, or High Risk Myelodysplastic Syndrome (MDS)",PHASE1/PHASE2,WITHDRAWN,31/3/2009,30/9/2010,30/6/2010,0,ACTUAL,,,['Myelodysplastic Syndrome'],['Rigosertib Sodium'],[],[],[],[],[]
15197,NCT00931450,Sunitinib Malate and Exemestane in Treating Postmenopausal Women With Breast Cancer,"Pilot / Phase II Randomised, Double Blind, Placebo Controlled Multicenter Study With Biomarker Evaluation of Neoadjuvant Exemestane in Combination With Sunitinib in Post-menopausal Women With Hormone- Sensitive, Her-2 Negative Primary Breast Cancer.",PHASE1/PHASE2,UNKNOWN,31/3/2009,,31/10/2011,70,ESTIMATED,,,['Breast Cancer'],"['Exemestane', 'sunitinib malate', 'Placebo Control']","['B86', 'B9127']","[['Small Molecule'], []]","[['Small Molecule'], []]","[['Aromatase'], []]","[['aromatase'], []]"
22806,NCT01775423,A Study of BBI608 in Adult Patients With Advanced Malignancies,A Phase I Clinical Study of BBI608 in Adult Patients With Advanced Malignancies,PHASE1,COMPLETED,31/3/2009,6/8/2015,6/8/2015,87,ACTUAL,,,['Solid Tumors'],['Napabucasin'],['B1984'],[['Small Molecule']],[['Small Molecule']],[['Signal transducer and activator of transcription 3']],[['STAT3']]
14068,NCT00821886,Neoadjuvant Ixabepilone/Carboplatin/Trastuzumab in HER2-Positive Locally Advanced Breast Cancer,Phase II Study of Neoadjuvant Ixabepilone/Carboplatin/Trastuzumab in HER2-Positive Locally Advanced Breast Cancer,PHASE2,COMPLETED,28/2/2009,31/10/2014,31/7/2011,60,ACTUAL,,,['Breast Cancer'],"['Ixabepilone', 'Trastuzumab', 'Carboplatin']","['B186', 'B168', 'B274']","[['Small Molecule'], ['Antibody'], ['Small Molecule']]","[['Small Molecule'], ['Monoclonal Antibody'], ['Small Molecule']]","[['Tubulin beta-1 chain'], ['Receptor protein-tyrosine kinase erbB-2'], ['DNA']]","[['TUBB1'], ['HER2'], ['DNA']]"
14179,NCT00832819,E7080 in Combination With Carboplatin and Paclitaxel in Patients With Non-small Cell Lung Cancer (NSCLC),E7080 in Combination With Carboplatin and Paclitaxel in Patients With Non-small Cell Lung Cancer (NSCLC),PHASE1,COMPLETED,28/2/2009,31/10/2011,31/7/2011,28,ACTUAL,,,['Non-Small Cell Lung Cancer'],"['Lenvatinib', 'Paclitaxel', 'Carboplatin']","['B261', 'B1250', 'B274']","[['Small Molecule'], ['Small Molecule'], ['Small Molecule']]","[['Small Molecule'], ['Small Molecule'], ['Small Molecule']]","[['Fibroblast growth factor receptor 1', 'Fibroblast growth factor receptor 2', 'Fibroblast growth factor receptor 3', 'Fibroblast growth factor receptor 4', 'Platelet-derived growth factor receptor alpha', 'Stem cell growth factor receptor', 'Tyrosine-protein kinase receptor RET', 'Vascular endothelial growth factor receptor 1', 'Vascular endothelial growth factor receptor 2', 'Vascular endothelial growth factor receptor 3'], ['Tubulin beta-1 chain'], ['DNA']]","[['FGFR1', 'FGFR2', 'FGFR3', 'FGFR4', 'PDGFRÎ±', 'c-Kit', 'RET', 'VEGFR1', 'VEGFR2', 'VEGFR3'], ['TUBB1'], ['DNA']]"
14297,NCT00846508,Cisplatin Based Chemoradiation v.s Radiotherapy for Cervical Cancer and With Clinically Defined Good Prognosis,Phase III Randomized Trial of Comparing CCRT vs. RT Alone for Cervical Cancer Patients Primarily Treated by Radiotherapy and With Clinically Defined Good-prognosis,PHASE3,UNKNOWN,28/2/2009,31/1/2013,31/1/2012,208,ESTIMATED,,,['Cervical Cancer'],['Cisplatin'],['B49'],[['Small Molecule']],[['Small Molecule']],[['DNA']],[['DNA']]
18079,NCT01227408,"Neoadjuvant Doxorubicin, Polyglutamate Paclitaxel, Capecitabine and Metronomic Chemotherapy in Breast Cancer","Phase II Clinical Trial of Neoadjuvant Weekly Doxorubicin, Polyglutamate Paclitaxel, Capecitabine and Metronomic Chemotherapy in Breast Cancer",PHASE2,WITHDRAWN,28/2/2009,28/2/2011,28/2/2010,0,ACTUAL,,,['Breast Cancer'],"['Doxorubicin', 'Paclitaxel poliglumex', 'Capecitabine', 'Cyclophosphamide', 'Methotrexate']","['B1914', 'B689', 'B474', 'B2818', 'B997']","[['Small Molecule'], ['Small Molecule'], ['Small Molecule'], ['Small Molecule'], ['Small Molecule']]","[['Small Molecule'], ['Small Molecule'], ['Small Molecule'], ['Small Molecule'], ['Small Molecule']]","[['Top II inhibitors (Topoisomerase II inhibitors)'], ['Tubulin beta-1 chain'], ['Thymidylate synthase'], ['DNA'], ['Dihydrofolate reductase']]","[['TOP2'], ['TUBB1'], ['TYMS'], ['DNA'], ['DHFR']]"
15105,NCT00923247,"A Targeted Phase I/II Trial of ZD6474 (Vandetanib; ZACTIMA) Plus the Proteasome Inhibitor, Bortezomib (Velcade ), in Adults With Solid Tumors With a Focus on Hereditary or Sporadic, Locally Advanced or Metastatic Medullary Thyroid Cancer (MTC)","A Targeted Ph I/II Trial of ZD6474 (Vandetanib; CAPRELSA) Plus the Proteasome Inhibitor, Bortezomib (Velcade ), in Adults With Solid Tumors With a Focus on Hereditary or Sporadic, Locally Advanced or Metastatic Medullary Thyroid Ca (MTC)",PHASE1/PHASE2,TERMINATED,19/2/2009,9/12/2016,1/4/2016,22,ACTUAL,,,['Thyroid Gland Medullary Carcinoma'],"['Bortezomib', 'Vandetanib']","['B958', 'B854']","[['Small Molecule'], ['Small Molecule']]","[['Small Molecule'], ['Small Molecule']]","[['Proteasome'], ['Epidermal growth factor receptor erbB1', 'Tyrosine-protein kinase receptor RET', 'Vascular endothelial growth factor receptor 2']]","[['Proteasome'], ['EGFR', 'RET', 'VEGFR2']]"
14250,NCT00841555,Temozolomide and Radiation Therapy in Treating Patients With Newly Diagnosed Glioblastoma Multiforme or Anaplastic Astrocytoma,A Phase I Trial of Hypofraction Radiotherapy + Temozolomide in the Treatment of Patients With Glioblastoma Multiforme and Anaplastic Astrocytoma of the Brain,PHASE1,COMPLETED,13/2/2009,25/11/2014,13/2/2013,9,ACTUAL,,,['Anaplastic Astrocytoma'],"['Temozolomide', 'Radiation Therapy', 'Hypofractionated Radiation Therapy', 'Intensity-Modulated Radiation Therapy']",['B2056'],[['Small Molecule']],[['Small Molecule']],[['DNA']],[['DNA']]
14347,NCT00850785,Autologous Tumor DRibble Vaccine in Patients With Non-Small Cell Lung Cancer,A Pilot Study of Autologous Tumor DRibble Vaccine With Docetaxel in Stage IIIB and IV Non-Small Cell Lung Cancer,PHASE1,COMPLETED,31/1/2009,31/5/2012,31/5/2012,6,ACTUAL,,,['Non-Small Cell Lung Cancer'],"['Docetaxel', 'Granulocyte macrophage colony stimulating factor', 'DPV 001']","['B2814', 'B2912', 'B4310']","[['Small Molecule'], [], ['Cancer Vaccine']]","[['Small Molecule'], [], ['Dendritic Cell Vaccine']]","[['Tubulin beta-1 chain'], ['Granulocyte-macrophage colony-stimulating factor receptor'], ['Toll-like receptor']]","[['TUBB1'], ['CSF-2R'], ['TLR']]"
58030,NCT00807872,Radioimmunoimaging of AL Amyloidosis,Radioimmunoimaging (PET/CT) of Patients With AL Amyloidosis Using the 124I-Labeled Amyloid-Reactive Monoclonal Antibody Mu 11-1F4,PHASE1,COMPLETED,31/12/2008,31/7/2013,31/3/2012,40,ACTUAL,,,['Primary Amyloidosis'],['124I-labeled monoclonal antibody Mu 11-1F4'],['B11441'],[['Antibody']],[['Monoclonal Antibody']],[[]],[[]]
14140,NCT00828841,Phase 2b Study of Cetuximab With Platinum-Based Chemo as First Line Treatment of Recurrent or Advanced NSCLC,A Multi-Center Randomized Phase 2b Study of Cetuximab (Erbitux) in Combination With Platinum-Based Chemotherapy as First Line Treatment of Patients With Recurrent or Advanced Non-Small Cell Lung Cancer (NSCLC),PHASE2,COMPLETED,31/12/2008,31/8/2012,31/7/2012,601,ACTUAL,,,['Non-Small Cell Lung Cancer'],"['Cetuximab', 'Paclitaxel', 'Carboplatin', 'Gemcitabine', 'Cisplatin']","['B164', 'B1250', 'B274', 'B2079', 'B49']","[['Antibody'], ['Small Molecule'], ['Small Molecule'], ['Small Molecule'], ['Small Molecule']]","[['Monoclonal Antibody'], ['Small Molecule'], ['Small Molecule'], ['Small Molecule'], ['Small Molecule']]","[['Epidermal growth factor receptor erbB1'], ['Tubulin beta-1 chain'], ['DNA'], ['DNA', 'Ribonucleotide reductase'], ['DNA']]","[['EGFR'], ['TUBB1'], ['DNA'], ['DNA', 'RNR'], ['DNA']]"
14175,NCT00832520,Phase II Study of Remeron for Cancer Patients Losing More Than 10% of Their Body Weight,INST 0816: Phase II Study of Remeron for Cancer Patients Losing More Than 10% of Their Body Weight,PHASE2,TERMINATED,30/11/2008,30/6/2011,31/7/2010,13,ACTUAL,,,['Digestive System Neoplasm'],['Mirtazapine'],['B1991'],[['Small Molecule']],[['Small Molecule']],[['Adrenergic receptors alpha-2']],[['ADRA2']]
