ID-datalake,nct_id,brief_title,official_title,phase,recruitment_status,start_date,completion_date,primary_completion_date,enrollment,enrollment_type,lead_sponsor,sponsor_organization,indications,interventions_drugs,drugs_datalake,main_technologies,specific_technologies,target_names,target_abbreviations
28611,NCT02494713,Hormonal Therapy and Chemotherapy Followed by Prostatectomy in Patients With Prostate Cancer,Neoadjuvant Androgen Deprivation Therapy and Chemotherapy Followed by Radical Prostatectomy in Patients With Prostate Cancer,PHASE2,TERMINATED,31/10/2015,14/9/2017,14/9/2017,4,ACTUAL,,,['Prostate Cancer'],"['Degarelix', 'Doxorubicin', 'Ketoconazole', 'Docetaxel', 'Estramustine']","['B1231', 'B1914', 'B349', 'B2814', 'B350']","[['Engineered Protein Therapy'], ['Small Molecule'], ['Small Molecule'], ['Small Molecule'], ['Small Molecule']]","[['Synthetic Peptide'], ['Small Molecule'], ['Small Molecule'], ['Small Molecule'], ['Small Molecule']]","[['Gonadotropin-releasing hormone receptor'], ['Top II inhibitors (Topoisomerase II inhibitors)'], [], ['Tubulin beta-1 chain'], ['Src homology phosphotyrosyl phosphatase 2']]","[['GnRHR'], ['TOP2'], ['C14DM'], ['TUBB1'], ['SHP2']]"
28794,NCT02514603,A Study of Prexasertib (LY2606368) in Japanese Participants With Advanced Cancers,A Phase 1 Study of LY2606368 in Japanese Patients With Advanced Solid Tumors,PHASE1,COMPLETED,31/10/2015,10/4/2017,10/4/2017,12,ACTUAL,,,['Male Reproductive System Neoplasm'],['Prexasertib'],['B1009'],[['Small Molecule']],[['Small Molecule']],"[['Checkpoint kinase 1', 'Checkpoint kinase 2']]","[['Chk1', 'Chk2']]"
29253,NCT02574533,Pilot Study of Vigilâ„¢ + Pembrolizumab for Advanced Melanoma,A Pilot Study of Vigilâ„¢ Augmented Autologous Tumor Cell Immunotherapy in Combination With Pembrolizumab PD-1 Inhibitor for Patients With Advanced Melanoma,PHASE1,COMPLETED,31/10/2015,30/9/2017,30/9/2017,2,ACTUAL,,,"['Skin Melanoma', 'Malignant Melanoma', 'Male Reproductive System Neoplasm']","['Armodafinil', 'Pembrolizumab']","['B118', 'B936']","[['Small Molecule'], ['Antibody']]","[['Small Molecule'], ['Monoclonal Antibody']]","[['Dopamine receptors', 'Dopamine transporter'], ['Programmed cell death protein 1']]","[['DRDs', 'DAT'], ['PD-1']]"
29906,NCT02648711,"Alternative Dosing for CRLX101(NLG207) Alone, With Avastin and With mFOLFOX6 in Advanced Solid Tumors",Evaluation of an Alternative Schedule for CRLX101 Alone in Combination With Bevacizumab and in Combination With mFOLFOX6 in Subjects With Advanced Solid Tumor Malignancies,PHASE1,TERMINATED,31/10/2015,7/5/2018,17/10/2017,41,ACTUAL,,,['Solid Tumors'],"['Davamotecan Pegadexamer', 'Bevacizumab', 'mFOLFOX6']",['B167'],[['Antibody']],[['Monoclonal Antibody']],[['Vascular endothelial growth factor A']],[['VEGF-A']]
30741,NCT02752204,An Evaluation AZD2014 Alone and in Combination With Rituximab in Relapsed/Refractory Diffuse Large B Cell Lymphoma,Torch: A Phase II Study to Determine the Safety and Efficacy of the Dual mTORC Inhibitor AZD2014 and to Investigate Additional Toxicities in Combination With Rituximab in Relapsed/Refractory Diffuse Large B Cell Lymphoma (DLBCL),PHASE2,COMPLETED,31/10/2015,6/2/2020,7/9/2017,36,ACTUAL,,,['Diffuse Large B-Cell Lymphoma'],"['Vistusertib', 'Rituximab']","['B824', 'B163']","[['Small Molecule'], ['Antibody']]","[['Small Molecule'], ['Monoclonal Antibody']]","[['Serine/threonine-protein kinase mTOR'], ['B-lymphocyte antigen CD20']]","[['mTOR'], ['CD20']]"
27067,NCT02308072,Phase I Study of Olaparib Combined With Cisplatin-based Chemoradiotherapy to Treat Locally Advanced Head and Neck Cancer,A Phase I Trial of Olaparib in Addition to Cisplatin-based Concurrent Chemoradiotherapy for Patients With High Risk Locally Advanced Squamous Cell Carcinoma of the Head and Neck (NHSCC),PHASE1,ACTIVE_NOT_RECRUITING,30/9/2015,28/2/2025,30/6/2020,70,ESTIMATED,,,['Head and Neck Neoplasm'],"['Olaparib', 'Cisplatin', 'Intensity-Modulated Radiation Therapy']","['B1818', 'B49']","[['Small Molecule'], ['Small Molecule']]","[['Small Molecule'], ['Small Molecule']]","[['PARP1 inhibitors(Poly (ADP-Ribose) polymerase 1 inhibitors)', 'PARP2 inhibitors(Poly (ADP-Ribose) Polymerase 2 inhibitors)', 'Poly'], ['DNA']]","[['PARP1', 'PARP2', 'PARP3'], ['DNA']]"
36342,NCT03507088,Study to Determine the Utility of FES-PET in the Prediction of Response to Fulvestrant in Women With Estrogen Positive Metastatic Breast Cancer,Fluorine-18 Fluoroestradiol Positron Emission Tomography-computed Tomography: an in Vivo Biomarker Predicting Response to Fulvestrant in Women With Estrogen Positive Metastatic Breast Cancer?,,COMPLETED,1/9/2015,1/7/2018,1/7/2018,36,ACTUAL,,,['Brain Metastasis'],['Contrast Enhanced PET-CT Scan'],[],[],[],[],[]
26000,NCT02166658,A Study of Cabazitaxel for Patients With Breast or Lung Cancer and Recurrent or Progressive Brain Metastases - Cabazitaxel for Brain Metastases (CaBaMet),A Phase II Study of Cabazitaxel for Patients With Breast or Lung Cancer and Recurrent or Progressive Brain Metastases - Cabazitaxel for Brain Metastases (CaBaMet),PHASE2,TERMINATED,31/8/2015,18/1/2018,30/4/2017,8,ACTUAL,,,"['Breast Cancer', 'Thoracic Neoplasm', 'Central Nervous System Neoplasm', 'Progressive Brain Metastases']",['Cabazitaxel'],['B185'],[['Small Molecule']],[['Small Molecule']],[['Tubulin beta-1 chain']],[['TUBB1']]
28790,NCT02514382,"Wild-Type Reovirus, Bortezomib, and Dexamethasone in Treating Patients With Relapsed or Refractory Multiple Myeloma",A Phase 1b Study of REOLYSINÂ® (Reovirus Serotype 3 - Dearing Strain) Combined With Standard Doses of Bortezomib and Dexamethasone in Patients With Relapsed/Refractory Multiple Myeloma,PHASE1,COMPLETED,21/8/2015,19/4/2022,19/4/2022,14,ACTUAL,,,"['Multiple Myeloma', 'Multiple Myeloma']","['Bortezomib', 'Dexamethasone', 'Laboratory Biomarker Analysis', 'Pelareorep']","['B958', 'B1128', 'B1022']","[['Small Molecule'], ['Small Molecule'], ['Oncolytic Virus']]","[['Small Molecule'], ['Small Molecule'], ['Oncolytic Virus']]","[['Proteasome'], ['Glucocorticoid receptor'], []]","[['Proteasome'], ['GR'], []]"
58958,NCT02526329,Donor Regulatory T Cells in Treating Patients With Visceral Acute Graft-versus-Host Disease After Stem Cell Transplant,A Phase 1 Single Center Safety and Feasibility Study of Primary T Regulatory Cell Therapy to Treat Visceral Acute Graft-versus-Host Disease Following Hematopoietic Cell Transplantation,PHASE1,WITHDRAWN,6/8/2015,30/6/2023,30/11/2022,0,ACTUAL,,,['Graft Versus Host Disease'],"['Donor Regulatory T-lymphocytes', 'Laboratory Biomarker Analysis']",[],[],[],[],[]
27565,NCT02367040,Copanlisib and Rituximab in Relapsed Indolent B-cell Non-Hodgkin's Lymphoma (iNHL),"A Phase III, Randomized, Double-blind, Placebo-controlled Study Evaluating the Efficacy and Safety of Copanlisib in Combination With Rituximab in Patients With Relapsed Indolent B-cell Non-Hodgkin's Lymphoma (iNHL) - CHRONOS-3",PHASE3,COMPLETED,3/8/2015,15/11/2024,31/8/2020,458,ACTUAL,,,['Non-Hodgkin Lymphoma'],"['Copanlisib', 'Placebo Control', 'Rituximab']","['B954', 'B163']","[['Small Molecule'], ['Antibody']]","[['Small Molecule'], ['Monoclonal Antibody']]","[['Phosphatidylinositol 3 kinase alpha', 'Phosphatidylinositol 3 kinase delta'], ['B-lymphocyte antigen CD20']]","[['PI3KÎ±', 'PI3KÎ´'], ['CD20']]"
27675,NCT02383966,Phase III Trial to Assess Efficacy and Safety of Cetuximab for the Treatment of Chinese Participants With Head and Neck Cancer,"A Multicenter, Randomized, Open-label, Phase III Trial to Assess Efficacy and Safety of Cetuximab When Given in Combination With Cisplatin Plus 5 Fluorouracil Versus Cisplatin Plus 5-fluorouracil Alone for the First-line Treatment of Chinese Subjects With Recurrent and/or Metastatic Squamous Cell Carcinoma of the Head and Neck",PHASE3,COMPLETED,31/7/2015,20/12/2021,19/1/2018,243,ACTUAL,,,['Head and Neck Squamous Cell Carcinoma'],"['Cetuximab', 'Cisplatin', 'Carboplatin', 'Fluorouracil']","['B164', 'B49', 'B274', 'B493']","[['Antibody'], ['Small Molecule'], ['Small Molecule'], ['Small Molecule']]","[['Monoclonal Antibody'], ['Small Molecule'], ['Small Molecule'], ['Small Molecule']]","[['Epidermal growth factor receptor erbB1'], ['DNA'], ['DNA'], ['Thymidylate synthase']]","[['EGFR'], ['DNA'], ['DNA'], ['TYMS']]"
28626,NCT02496208,Cabozantinib S-malate and Nivolumab With or Without Ipilimumab in Treating Patients With Metastatic Genitourinary Tumors,A Phase 1 Study of Cabozantinib Plus Nivolumab (CaboNivo) Alone or in Combination With Ipilimumab (CaboNivoIpi) in Patients With Advanced/Metastatic Urothelial Carcinoma and Other Genitourinary Tumors,PHASE1,ACTIVE_NOT_RECRUITING,22/7/2015,30/9/2026,30/9/2026,152,ESTIMATED,,,"['Urinary Tract Carcinoma', 'Clear Cell Renal Cell Carcinoma', 'Urothelial Carcinoma', 'Urinary Tract Squamous Cell Carcinoma', 'Urothelial Carcinoma', 'Urothelial Carcinoma', 'Urothelial Carcinoma', 'Kidney Cancer', 'Genitourinary System Neoplasm', 'Solid Tumors', 'Renal Cell Carcinoma', 'Male Reproductive System Neoplasm', 'Male Reproductive System Neoplasm', 'Ureter Urothelial Carcinoma', 'Urethral Cancer', 'Ureter Urothelial Carcinoma', 'Ureter Urothelial Carcinoma', 'Renal Pelvis Carcinoma', 'Non-Clear Cell Renal Cell Carcinoma', 'Bladder Cancer', 'Male Reproductive System Neoplasm', 'Renal Cell Carcinoma', 'Urothelial Carcinoma', 'Urothelial Carcinoma', 'Ureter Urothelial Carcinoma', 'Urethral Cancer', 'Bladder Cancer', 'Male Reproductive System Neoplasm', 'Renal Cell Carcinoma', 'Urothelial Carcinoma']","['Biopsy', 'Biospecimen Collection', 'cabozantinib s-malate', 'Computed Tomography', 'Echocardiography', 'Ipilimumab', 'Magnetic Resonance Imaging', 'Nivolumab']","['B8690', 'B480', 'B714']","[[], ['Antibody'], ['Antibody']]","[[], ['Monoclonal Antibody'], ['Monoclonal Antibody']]","[[], ['Cytotoxic T-Lymphocyte-Associated Antigen 4'], ['Programmed cell death protein 1']]","[[], ['CTLA4'], ['PD-1']]"
27975,NCT02420223,Study of Propranolol to Decrease Gene Expression of Stress-Mediated Beta-Adrenergic Pathways in HCT Recipients,Randomized Controlled Pilot Study Using Propranolol to Decrease Gene Expression of Stress-Mediated Beta-Adrenergic Pathways in Hematopoietic Stem Cell Transplant (HCT) Recipients,PHASE2,COMPLETED,17/7/2015,29/2/2020,31/7/2018,25,ACTUAL,,,['Multiple Myeloma'],['Propranolol'],['B872'],[['Small Molecule']],[['Small Molecule']],[['Beta adrenergic receptors']],[['Î²-adrenoceptors']]
28117,NCT02436408,VISmodegib for ORbital and Periocular Basal Cell Carcinoma,VISmodegib for ORbital and Periocular Basal Cell Carcinoma (VISORB),PHASE4,COMPLETED,15/7/2015,30/9/2020,30/9/2020,35,ACTUAL,,,['Epithelial Neoplasm'],['Vismodegib'],['B1643'],[['Small Molecule']],[['Small Molecule']],[['Smoothened receptor']],[['SMO']]
28638,NCT02497378,A Study of JNJ-54767414 (Daratumumab) in Combination With Bortezomib and Dexamethasone (D-Vd) in Japanese Participants With Relapsed or Refractory Multiple Myeloma,A Phase 1b Study of JNJ-54767414 (Daratumumab) in Combination With Bortezomib and Dexamethasone (D-Vd) in Japanese Patients With Relapsed or Refractory Multiple Myeloma (MM),PHASE1,COMPLETED,10/7/2015,6/3/2018,6/3/2018,8,ACTUAL,,,['Multiple Myeloma'],"['Daratumumab', 'Bortezomib', 'Dexamethasone']","['B415', 'B958', 'B1128']","[['Antibody'], ['Small Molecule'], ['Small Molecule']]","[['Monoclonal Antibody'], ['Small Molecule'], ['Small Molecule']]","[['Lymphocyte differentiation antigen CD38'], ['Proteasome'], ['Glucocorticoid receptor']]","[['CD38'], ['Proteasome'], ['GR']]"
21296,NCT01591356,EphA2 siRNA in Treating Patients With Advanced or Recurrent Solid Tumors,EphA2 Gene Targeting Using Neutral Liposomal Small Interfering RNA Delivery: A Phase I Clinical Trial,PHASE1,ACTIVE_NOT_RECRUITING,1/7/2015,30/4/2025,30/4/2025,49,ACTUAL,,,['Solid Tumors'],"['EphA2-targeting DOPC-encapsulated siRNA', 'Laboratory Biomarker Analysis']",[],[],[],[],[]
28503,NCT02482311,"Safety, Tolerance, PK, and Anti-tumour Activity of AZD1775 Monotherapy in Patients With Advanced Solid Tumours","A Phase Ib, Open-Label, Multi-Centre Study to Assess the Safety, Tolerability, Pharmacokinetics, and Anti-tumour Activity of AZD1775 Monotherapy in Patients With Advanced Solid Tumours",PHASE1,COMPLETED,1/7/2015,22/8/2019,25/1/2018,92,ACTUAL,,,['Ovarian Cancer'],['Adavosertib'],['B532'],[['Small Molecule']],[['Small Molecule']],[['Serine/threonine-protein kinase WEE1']],[['WEE1']]
28134,NCT02438358,Feasibility Study of Intraoperative Imaging in Breast Cancer,Feasibility of the LUM Imaging System for Intraoperative Detection of Residual Cancer in the Tumor Bed of Female Subjects With Breast Cancer,PHASE1/PHASE2,COMPLETED,30/6/2015,31/10/2017,30/9/2017,60,ACTUAL,,,['Breast Cancer'],"['Pegulicianine acetate', 'LUM Imaging Device']",['B1499'],[['Imaging']],[['Imaging Agent']],[['Cathepsin']],[['Cathepsin']]
28574,NCT02489903,"RRx-001 in Lung Cancer, Ovarian Cancer and Neuroendocrine Tumors Prior to Re-administration of Platinum Based Doublet Regimens (QUADRUPLE THREAT)","A Phase II Study of RRx-001 in Platinum Refractory/Resistant Small Cell Carcinoma, EGFR TKI Resistant EGFR+ T790M Negative Non-Small Cell Lung Cancer, High Grade Neuroendocrine Tumors and Resistant/Refractory Ovarian Cancer Prior to Re-administration of Platinum Based Doublet Regimens (QUADRUPLE THREAT)",PHASE2,COMPLETED,30/6/2015,6/12/2021,6/12/2021,139,ACTUAL,,,"['Neuroendocrine Carcinoma', 'Non-Small Cell Lung Cancer', 'Neuroendocrine Tumors', 'Ovarian Cancer']","['Nibrozetone', 'Cisplatin', 'Etoposide', 'Carboplatin', 'Irinotecan', 'Vinorelbine', 'Pegylated liposomal doxorubicin', 'Gemcitabine', 'Taxanes', 'Paclitaxel', 'Nab-paclitaxel', 'Pemetrexed']","['B2298', 'B49', 'B1463', 'B274', 'B1679', 'B1929', 'B2819', 'B2079', 'B3069', 'B1250', 'B7744', 'B814']","[['Small Molecule'], ['Small Molecule'], ['Small Molecule'], ['Small Molecule'], ['Small Molecule'], ['Small Molecule'], ['Small Molecule'], ['Small Molecule'], ['Small Molecule'], ['Small Molecule'], ['Small Molecule'], ['Small Molecule']]","[['Small Molecule'], ['Small Molecule'], ['Small Molecule'], ['Small Molecule'], ['Small Molecule'], ['Small Molecule'], ['Small Molecule'], ['Small Molecule'], ['Small Molecule'], ['Small Molecule'], ['Small Molecule'], ['Small Molecule']]","[['Cluster of differentiation 47', 'NACHT, LRR and PYD domains-containing protein 3'], ['DNA'], ['Top II inhibitors (Topoisomerase II inhibitors)'], ['DNA'], ['DNA topoisomerase I'], ['Tubulin beta-1 chain'], ['DNA', 'Top II inhibitors (Topoisomerase II inhibitors)'], ['DNA', 'Ribonucleotide reductase'], ['Tubulin beta-1 chain'], ['Tubulin beta-1 chain'], ['Tubulin beta-1 chain'], ['Dihydrofolate reductase', 'GAR transformylase', 'Thymidylate synthase']]","[['c-Myc', 'CD47', 'NLRP3'], ['DNA'], ['TOP2'], ['DNA'], ['TOP1'], ['TUBB1'], ['DNA', 'TOP2'], ['DNA', 'RNR'], ['TUBB1'], ['TUBB1'], ['TUBB1'], ['DHFR', 'GART', 'TYMS']]"
26289,NCT02207309,Pazopanib Maintenance Phase II,"A Randomized, Double Blind, Phase II Trial of Pazopanib Versus Placebo as Maintenance Therapy in Patients With Retroperitoneal and Visceral High-risk Soft Tissue Sarcomas Following Prior Neo- and/or Adjuvant Doxorubicin / Ifosfamide Chemotherapy With Regional Hyperthermia",PHASE2,TERMINATED,22/6/2015,29/7/2016,29/7/2016,1,ACTUAL,,,['Sarcoma'],"['Pazopanib', 'Placebo Control']",['B1649'],[['Small Molecule']],[['Small Molecule']],"[['Platelet-derived growth factor receptor alpha', 'Platelet-derived growth factor receptor beta', 'Stem cell growth factor receptor', 'Vascular endothelial growth factor receptor 1', 'Vascular endothelial growth factor receptor 2', 'Vascular endothelial growth factor receptor 3']]","[['PDGFRÎ±', 'PDGFRÎ²', 'c-Kit', 'VEGFR1', 'VEGFR2', 'VEGFR3']]"
38225,NCT03757754,HPPH Photodynamic Therapy for Patients With Esophageal Cancer,"Evalution of Safety, Tolerability and Pharmacokinetics of of HPPH in Ascending Dose for Cancer Patients in Phase I Clinical Trial",PHASE1,UNKNOWN,3/6/2015,27/5/2019,20/1/2019,30,ESTIMATED,,,['Esophageal Cancer'],"['HPPH', 'Light Dosimetry', 'CLR 1404 I-124']","['B1701', 'B3484']","[['Small Molecule'], ['Imaging']]","[['Small Molecule'], ['Imaging Agent']]","[[], ['Serine/threonine-protein kinase AKT']]","[[], ['AKT1']]"
27758,NCT02394795,"Panitumumab and RAS, Diagnostically-useful Gene Mutation for mCRC","A Phase III, Randomized, Controlled Study of mFOLFOX6 + Bevacizumab Combination Therapy Versus mFOLFOX6 + Panitumumab Combination Therapy in Chemotherapy-naive Patients With KRAS/NRAS Wild-type, Incurable/Unresectable, Advanced/Recurrent Colorectal Cancer",PHASE3,COMPLETED,29/5/2015,14/1/2022,14/1/2022,823,ACTUAL,,,['Colorectal Cancer'],"['Oxaliplatin', 'Levoleucovorin Calcium', 'Fluorouracil', 'Panitumumab', 'Bevacizumab']","['B1229', 'B9431', 'B493', 'B194', 'B167']","[['Small Molecule'], [], ['Small Molecule'], ['Antibody'], ['Antibody']]","[['Small Molecule'], [], ['Small Molecule'], ['Monoclonal Antibody'], ['Monoclonal Antibody']]","[['DNA'], [], ['Thymidylate synthase'], ['Epidermal growth factor receptor erbB1'], ['Vascular endothelial growth factor A']]","[['DNA'], [], ['TYMS'], ['EGFR'], ['VEGF-A']]"
27775,NCT02396134,Vaccine Therapy in Reducing the Frequency of Cytomegalovirus Events in Patients With Hematologic Malignancies Undergoing Donor Stem Cell Transplant,"A Phase II Randomized, Placebo-Controlled, Multicenter Trial to Evaluate Protective Function of an Optimized Dose of CMVPepVax in Recipients of an Allogeneic Hematopoietic Stem Cell Transplant",PHASE2,COMPLETED,21/5/2015,19/9/2024,4/3/2018,61,ACTUAL,,,"['Chronic Myeloid Leukemia', 'Acute Lymphoblastic Leukemia', 'AML with maturation', 'Hodgkin Lymphoma', 'Non-Hodgkin Lymphoma', 'Chronic Myeloid Leukemia', 'Cytomegaloviral Infection', 'Hematology', 'HLA-A*0201 Positive Cells Present', 'Myelodysplastic Syndrome', 'Non-Hodgkin Lymphoma', 'Chronic Lymphocytic Leukemia', 'Primary Myelofibrosis', 'Myeloproliferative Neoplasm']","['CMVpp65-A*0201 Peptide Vaccine', 'Placebo Control', 'Laboratory Biomarker Analysis']",[],[],[],[],[]
42975,NCT04440956,An Imaging Study of 64Cu-SARTATE Using Positron Emission Tomography in Patients With Neuroendocrine Tumours,"Positron Emission Tomography (PET) Imaging of Patients With Low & Intermediate Grade Neuroendocrine Tumors Using 64Cu-SARTATE: A Single Centre, Open-Label, Non-Randomized, Phase-0 Microdosing Investigation",EARLY_PHASE1,COMPLETED,21/5/2015,25/2/2016,25/2/2016,10,ACTUAL,,,['Neuroendocrine Tumors'],['64Cu-SARTATE'],['B2812'],[['Radiopharmaceutical Imaging']],[['Radiopharmaceutical Imaging']],[['Somatostatin receptor 2']],[['SSTR2']]
26939,NCT02292550,Study of Safety and Efficacy of LEE011 and Ceritinib in Patients With ALK-positive Non-small Cell Lung Cancer.,A Phase Ib/II Study of the ALK Inhibitor Ceritinib in Combination With the CDK4/6 Inhibitor LEE011 in Patients With ALK-positive Non-Small Cell Lung Cancer,PHASE1,COMPLETED,14/5/2015,26/9/2018,26/9/2018,27,ACTUAL,,,['Non-Small Cell Lung Cancer'],"['Ribociclib', 'Ceritinib']","['B1026', 'B850']","[['Small Molecule'], ['Small Molecule']]","[['Small Molecule'], ['Small Molecule']]","[['Cyclin-dependent kinase 4', 'Cyclin-dependent kinase 6'], ['Anaplastic lymphoma kinase']]","[['CDK4', 'CDK6'], ['ALK']]"
27114,NCT02314169,Nivolumab With or Without Ipilimumab in Treating Patients With Refractory Metastatic Anal Canal Cancer,A Multi-Institutional Phase 2 Study of Nivolumab or Nivolumab in Combination With Ipilimumab in Refractory Metastatic Squamous Cell Carcinoma of the Anal Canal,PHASE2,ACTIVE_NOT_RECRUITING,13/5/2015,21/3/2026,15/2/2025,37,ACTUAL,,,"['Anal Cancer', 'Anal Cancer', 'Anal Cancer']","['Biospecimen Collection', 'Computed Tomography', 'Ipilimumab', 'Magnetic Resonance Imaging', 'Nivolumab']","['B480', 'B714']","[['Antibody'], ['Antibody']]","[['Monoclonal Antibody'], ['Monoclonal Antibody']]","[['Cytotoxic T-Lymphocyte-Associated Antigen 4'], ['Programmed cell death protein 1']]","[['CTLA4'], ['PD-1']]"
26928,NCT02291055,A Study of ADXS11-001 or MEDI4736 Alone or Combination In Cervical or Human Papillomavirus (HPV)+ Head & Neck Cancer,Phase 1-2 Study of ADXS11-001 or MEDI4736 Alone or Combination In Previously Treated Locally Advanced or Metastatic Cervical or HPV+ Head & Neck Cancer,PHASE1/PHASE2,TERMINATED,30/4/2015,20/11/2020,9/7/2019,75,ACTUAL,,,"['Cervical Cancer', 'Cancer', 'Head and Neck Neoplasm']","['Axalimogene filolisbac', 'Durvalumab']","['B3449', 'B977']","[['Oncolytic Bacteria'], ['Antibody']]","[['Oncolytic Bacteria'], ['Monoclonal Antibody']]","[['Protein E7'], ['Programmed death-ligand 1']]","[['E7'], ['PDL1']]"
27463,NCT02353741,Concurrent EGFR-TKIs and Thoracic Radiation Therapy in Active EGFR Mutation for 1st Line Treatment of Stage IV NSCLC,"Concurrent EGFR-TKIs and Thoracic Radiation Therapy in EGFR Active Mutation for the First Line Treatment of Non-Small Cell Lung Cancer at Stage IV: A Single-arm, Open-label, Single Center, Phase II Trial.",PHASE2,TERMINATED,30/4/2015,1/12/2018,30/6/2018,10,ACTUAL,,,['Non-Small Cell Lung Cancer'],"['Erlotinib', 'Thoracic Radiation Therapy']",['B1928'],[['Small Molecule']],[['Small Molecule']],[['Epidermal growth factor receptor erbB1']],"[['EGFR L858R', 'EGFR-Ex19del', 'EGFR']]"
28906,NCT02530411,Fulvestrant +/- Vandetanib in Advanced Aromatase Inhibitor Resistant Breast Cancer,A Randomised Double Blind Placebo Controlled Phase II Study of Fulvestrant With or Without the Addition of Vandetanib as Treatment for Patients With Metastatic Breast Cancer Resistant to Aromatase Inhibitor Therapy,PHASE2,UNKNOWN,30/4/2015,31/12/2020,31/12/2018,160,ESTIMATED,,,['Neoplasms'],"['Fulvestrant', 'Vandetanib']","['B276', 'B854']","[['Small Molecule'], ['Small Molecule']]","[['Small Molecule'], ['Small Molecule']]","[['Estrogen receptors'], ['Epidermal growth factor receptor erbB1', 'Tyrosine-protein kinase receptor RET', 'Vascular endothelial growth factor receptor 2']]","[['ER'], ['EGFR', 'RET', 'VEGFR2']]"
31568,NCT02866370,Study Of Nintedanib Compared To Chemotherapy in Patients With Recurrent Clear Cell Carcinoma Of The Ovary Or Endometrium,A Randomised Phase II Study Of Nintedanib (BIBF1120) Compared To Chemotherapy in Patients With Recurrent Clear Cell Carcinoma Of The Ovary Or Endometrium,PHASE2,UNKNOWN,30/4/2015,31/3/2021,31/3/2020,120,ESTIMATED,,,"['Ovarian Clear Cell Adenocarcinoma', 'Endometrial Clear Cell Adenocarcinoma']","['Nintedanib', 'Paclitaxel', 'Carboplatin', 'Pegylated liposomal doxorubicin', 'Topotecan', 'Doxorubicin']","['B1705', 'B1250', 'B274', 'B2819', 'B2067', 'B1914']","[['Small Molecule'], ['Small Molecule'], ['Small Molecule'], ['Small Molecule'], ['Small Molecule'], ['Small Molecule']]","[['Small Molecule'], ['Small Molecule'], ['Small Molecule'], ['Small Molecule'], ['Small Molecule'], ['Small Molecule']]","[['Fibroblast growth factor receptor 1', 'Fibroblast growth factor receptor 2', 'Fibroblast growth factor receptor 3', 'Platelet-derived growth factor receptor alpha', 'Platelet-derived growth factor receptor beta', 'Tyrosine-protein kinase receptor FLT3', 'Vascular endothelial growth factor receptor 1', 'Vascular endothelial growth factor receptor 2', 'Vascular endothelial growth factor receptor 3'], ['Tubulin beta-1 chain'], ['DNA'], ['DNA', 'Top II inhibitors (Topoisomerase II inhibitors)'], ['DNA topoisomerase I'], ['Top II inhibitors (Topoisomerase II inhibitors)']]","[['FGFR1', 'FGFR2', 'FGFR3', 'PDGFRÎ±', 'PDGFRÎ²', 'FLT3', 'VEGFR1', 'VEGFR2', 'VEGFR3'], ['TUBB1'], ['DNA'], ['DNA', 'TOP2'], ['TOP1'], ['TOP2']]"
28125,NCT02437227,"A Phase I, First in Man Study to Evaluate the Safety and Tolerability of a panRAF Inhibitor (CCT3833/BAL3833)in Patients With Solid Tumours","A Phase 1, First in Man, Dual Centre, Open-label Dose Escalation Study With Expansion to Evaluate the Safety, Tolerability, Pharmacokinetics and Pharmacodynamics of CCT3833 (BAL3833), a panRAF Inhibitor, Given Orally in Patients With Advanced Solid Tumours, Including Metastatic Melanoma",PHASE1,COMPLETED,15/4/2015,31/7/2018,31/12/2017,31,ACTUAL,,,"['Male Reproductive System Neoplasm', 'Cancer']",['BAL 3833'],['B6689'],[['Small Molecule']],[['Small Molecule']],[['RAF serine/threonine protein kinase']],[['Raf kinase']]
27190,NCT02322281,"TIGER-3: Open Label, Multicenter Study of Rociletinib (CO-1686) Mono Therapy Versus Single-agent Cytotoxic Chemotherapy in Patients With Mutant EGFR NSCLC Who Have Failed at Least One Previous EGFR-Directed TKI and Platinum-doublet Chemotherapy","TIGER-3: A Phase 3, Open-label, Multicenter, Randomized Study of Oral Rociletinib (CO-1686) Monotherapy Versus Single-agent Cytotoxic Chemotherapy in Patients With Mutant EGFR Non-small Cell Lung Cancer (NSCLC) After Failure of at Least 1 Previous EGFR-directed Tyrosine Kinase Inhibitor (TKI) and Platinum-doublet Chemotherapy",PHASE3,TERMINATED,28/2/2015,29/3/2018,29/3/2018,149,ACTUAL,,,['Non-Small Cell Lung Cancer'],"['Rociletinib', 'Pemetrexed', 'Gemcitabine', 'Paclitaxel', 'Docetaxel']","['B1040', 'B814', 'B2079', 'B1250', 'B2814']","[['Small Molecule'], ['Small Molecule'], ['Small Molecule'], ['Small Molecule'], ['Small Molecule']]","[['Small Molecule'], ['Small Molecule'], ['Small Molecule'], ['Small Molecule'], ['Small Molecule']]","[['EGFR T790M'], ['Dihydrofolate reductase', 'GAR transformylase', 'Thymidylate synthase'], ['DNA', 'Ribonucleotide reductase'], ['Tubulin beta-1 chain'], ['Tubulin beta-1 chain']]","[['EGFR T790M'], ['DHFR', 'GART', 'TYMS'], ['DNA', 'RNR'], ['TUBB1'], ['TUBB1']]"
27392,NCT02345408,Phase 1b Study of CCX872-B in Patients With Pancreatic Adenocarcinoma,An Open-label Phase 1b Study to Evaluate the Safety and Efficacy of CCX872-B in Patients With Pancreatic Adenocarcinoma,PHASE1,COMPLETED,28/2/2015,6/5/2020,6/5/2020,54,ACTUAL,,,['Pancreatic Cancer'],['CCR2 Antagonist CCX872-B'],[],[],[],[],[]
